{
  "schema_version": 1,
  "document_revision": "0",
  "configuration": "Default",
  "coordinate_frame": "document",
  "length_unit": "metre",
  "bodies": [
    {
      "key": "sphere-cap-solid",
      "kind": "solid",
      "counts": {
        "faces": 2,
        "edges": 1,
        "vertices": 0,
        "shells": 1
      },
      "measurements_si": {
        "volume_m3": 6.544984694978736e-07,
        "area_m2": 0.0005497787143782138,
        "centroid_m": [
          1.3538755695467593e-19,
          1.8827622792572955e-35,
          0.006749999999999998
        ]
      },
      "geometry_types": [
        "circle",
        "plane",
        "sphere"
      ]
    }
  ],
  "properties": {
    "document": [],
    "configuration": []
  },
  "references": [],
  "unavailable_fields": [
    "native_regions",
    "original_surface_parameter_pcurves",
    "certified_geometric_error_bounds",
    "template_file_identity"
  ],
  "observations": {
    "measure_before_save": {
      "body_measurements": [
        {
          "area": 0.0005497787143782138,
          "body_kind": "solid",
          "calculation": {
            "accuracy_setting": "native_body_API_default",
            "api": "IBody2.GetMassProperties",
            "certified_error_bound": null,
            "density_argument": 1.0,
            "mass_reported": false
          },
          "ref": "native:7b22636f6e66696775726174696f6e223a2244656661756c74222c22646f63756d656e74223a22646f632d3162222c226672616d65223a22646f63756d656e74222c226b696e64223a22626f6479222c226c656e6774685f756e6974223a226d65747265222c226e61746976655f7570646174655f7374616d70223a3130342c2270657273697374656e74223a22353034363030303030343030303030306666666566663030303030303030303030313030303030303635303030303030222c227265666572656e63655f73636f7065223a22646f63756d656e745f7265766973696f6e5f636f6e66696775726174696f6e5f7570646174655f7374616d70222c227265766973696f6e223a337d",
          "sheet_perimeter": null,
          "topology_counts": {
            "bodies": 1,
            "edges": 1,
            "faces": 2,
            "loops": 2,
            "shell_provenance": "connected_native_face_edge_incidence",
            "shells": 1,
            "vertices": 0
          },
          "volume": 6.544984694978736e-07,
          "wire_length": null
        }
      ],
      "bounding_box": {
        "approximate": true,
        "max": [
          0.008660254037844387,
          0.008660254037844387,
          0.01
        ],
        "min": [
          -0.008660254037844387,
          -0.008660254037844387,
          0.005000000000000001
        ]
      },
      "bounding_box_scope": "selected_bodies_union",
      "configuration": "Default",
      "document": "doc-1b",
      "frame": "document",
      "geometry_totals": {
        "aggregation": "sum_of_selected_bodies; overlapping bodies counted independently",
        "sheet_area": 0.0,
        "solid_volume": 6.544984694978736e-07,
        "surface_area": 0.0005497787143782138,
        "units": {
          "area": "square_metre",
          "length": "metre",
          "volume": "cubic_metre"
        },
        "wire_length": 0.0
      },
      "hidden_bodies": "included",
      "length_unit": "metre",
      "mass_properties": {
        "area": 0.0005497787143782138,
        "calculation": {
          "api": "IMassProperty2.Recalculate",
          "certified_error_bound": null,
          "hidden_bodies": "included",
          "native_accuracy_level": 0,
          "units": "SI"
        },
        "center_of_mass": [
          1.3538755695467593e-19,
          1.8827622792572955e-35,
          0.006749999999999998
        ],
        "mass": 0.0006544984694978736,
        "status": 0,
        "volume": 6.544984694978736e-07
      },
      "native_update_stamp": 104,
      "reference_scope": "document_revision_configuration_update_stamp",
      "revision": 3,
      "selection_scope": "whole_document",
      "topology_counts": {
        "bodies": 1,
        "edges": 1,
        "faces": 2,
        "loops": 2,
        "shell_provenance": "connected_native_face_edge_incidence",
        "shells": 1,
        "vertices": 0
      }
    },
    "measure_reopened": {
      "body_measurements": [
        {
          "area": 0.0005497787143782138,
          "body_kind": "solid",
          "calculation": {
            "accuracy_setting": "native_body_API_default",
            "api": "IBody2.GetMassProperties",
            "certified_error_bound": null,
            "density_argument": 1.0,
            "mass_reported": false
          },
          "ref": "native:7b22636f6e66696775726174696f6e223a2244656661756c74222c22646f63756d656e74223a22646f632d3163222c226672616d65223a22646f63756d656e74222c226b696e64223a22626f6479222c226c656e6774685f756e6974223a226d65747265222c226e61746976655f7570646174655f7374616d70223a3130342c2270657273697374656e74223a22353034363030303030343030303030306666666566663030303030303030303030313030303030303635303030303030222c227265666572656e63655f73636f7065223a22646f63756d656e745f7265766973696f6e5f636f6e66696775726174696f6e5f7570646174655f7374616d70222c227265766973696f6e223a307d",
          "sheet_perimeter": null,
          "topology_counts": {
            "bodies": 1,
            "edges": 1,
            "faces": 2,
            "loops": 2,
            "shell_provenance": "connected_native_face_edge_incidence",
            "shells": 1,
            "vertices": 0
          },
          "volume": 6.544984694978736e-07,
          "wire_length": null
        }
      ],
      "bounding_box": {
        "approximate": true,
        "max": [
          0.008660254037844387,
          0.008660254037844387,
          0.01
        ],
        "min": [
          -0.008660254037844387,
          -0.008660254037844387,
          0.005000000000000001
        ]
      },
      "bounding_box_scope": "selected_bodies_union",
      "configuration": "Default",
      "document": "doc-1c",
      "frame": "document",
      "geometry_totals": {
        "aggregation": "sum_of_selected_bodies; overlapping bodies counted independently",
        "sheet_area": 0.0,
        "solid_volume": 6.544984694978736e-07,
        "surface_area": 0.0005497787143782138,
        "units": {
          "area": "square_metre",
          "length": "metre",
          "volume": "cubic_metre"
        },
        "wire_length": 0.0
      },
      "hidden_bodies": "included",
      "length_unit": "metre",
      "mass_properties": {
        "area": 0.0005497787143782138,
        "calculation": {
          "api": "IMassProperty2.Recalculate",
          "certified_error_bound": null,
          "hidden_bodies": "included",
          "native_accuracy_level": 0,
          "units": "SI"
        },
        "center_of_mass": [
          1.3538755695467593e-19,
          1.8827622792572955e-35,
          0.006749999999999998
        ],
        "mass": 0.0006544984694978736,
        "status": 0,
        "volume": 6.544984694978736e-07
      },
      "native_update_stamp": 104,
      "reference_scope": "document_revision_configuration_update_stamp",
      "revision": 0,
      "selection_scope": "whole_document",
      "topology_counts": {
        "bodies": 1,
        "edges": 1,
        "faces": 2,
        "loops": 2,
        "shell_provenance": "connected_native_face_edge_incidence",
        "shells": 1,
        "vertices": 0
      }
    },
    "measure_final": {
      "body_measurements": [
        {
          "area": 0.0005497787143782138,
          "body_kind": "solid",
          "calculation": {
            "accuracy_setting": "native_body_API_default",
            "api": "IBody2.GetMassProperties",
            "certified_error_bound": null,
            "density_argument": 1.0,
            "mass_reported": false
          },
          "ref": "native:7b22636f6e66696775726174696f6e223a2244656661756c74222c22646f63756d656e74223a22646f632d3163222c226672616d65223a22646f63756d656e74222c226b696e64223a22626f6479222c226c656e6774685f756e6974223a226d65747265222c226e61746976655f7570646174655f7374616d70223a3130342c2270657273697374656e74223a22353034363030303030343030303030306666666566663030303030303030303030313030303030303635303030303030222c227265666572656e63655f73636f7065223a22646f63756d656e745f7265766973696f6e5f636f6e66696775726174696f6e5f7570646174655f7374616d70222c227265766973696f6e223a307d",
          "sheet_perimeter": null,
          "topology_counts": {
            "bodies": 1,
            "edges": 1,
            "faces": 2,
            "loops": 2,
            "shell_provenance": "connected_native_face_edge_incidence",
            "shells": 1,
            "vertices": 0
          },
          "volume": 6.544984694978736e-07,
          "wire_length": null
        }
      ],
      "bounding_box": {
        "approximate": true,
        "max": [
          0.008660254037844387,
          0.008660254037844387,
          0.01
        ],
        "min": [
          -0.008660254037844387,
          -0.008660254037844387,
          0.005000000000000001
        ]
      },
      "bounding_box_scope": "selected_bodies_union",
      "configuration": "Default",
      "document": "doc-1c",
      "frame": "document",
      "geometry_totals": {
        "aggregation": "sum_of_selected_bodies; overlapping bodies counted independently",
        "sheet_area": 0.0,
        "solid_volume": 6.544984694978736e-07,
        "surface_area": 0.0005497787143782138,
        "units": {
          "area": "square_metre",
          "length": "metre",
          "volume": "cubic_metre"
        },
        "wire_length": 0.0
      },
      "hidden_bodies": "included",
      "length_unit": "metre",
      "mass_properties": {
        "area": 0.0005497787143782138,
        "calculation": {
          "api": "IMassProperty2.Recalculate",
          "certified_error_bound": null,
          "hidden_bodies": "included",
          "native_accuracy_level": 0,
          "units": "SI"
        },
        "center_of_mass": [
          1.3538755695467593e-19,